ML312,A Small Molecule Inhibitor of Scavenger Receptor BI-mediated Lipid Uptake—Probe 3,HL052212-11,,44487061,488952,Cardiovascular Diseases ,,,,,"488896,493194,540354,540354,588392,588392,588553,588553,588548,588548,588754,588754,588828,588828,588833,588833,602285,623880,623880,624029,624029,488952,540246,588842,588830,588829,588826,602126,623895,624026,588777,588810,624024,602134,588818,602152,624017,540326,588403,588825,624007,602154,624010,588831,624022,588836,624015,588843,602138,588837,602155",603,"222,822,292,230,223,000,000,000,000,000,000,000,000,000,000,000",Broad Institute Probe Development Center,Broad Institute Probe Development Center,"Monty Krieger, Biology Department, Massachusetts Institute of Technology",
ML314,Small Molecule Agonists for the Neurotensin 1 Receptor (NTR1 Agonists),MH089653-01 ,2,53245590,493055,Substance-Related Disorders ,,,,,"493,036,504,550,504,000,000,000,000,000,000,000,000,000,000,000,000,000,000,000,000,000,000,000,000,000,000,000",530,"163,316,381,639,294,000,000,000",Sanford-Burnham Center for Chemical Genomics,Sanford-Burnham Center for Chemical Genomics,"Lawrence R. Barak, Duke University Medical Center, Durham NC",
ML315,"Identification of selective inhibitors of cdc2-like kinases 1 and 4 (Clk1, Clk4).",MH084827,,46926514,1997,"Congenital, Hereditary, and Neonatal Diseases and Abnormalities ",,,,,"1,795,198,319,831,990,000,000,000,000,000,000,000,000,000,000,000,000,000,000,000,000,000,000,000,000,000,000,000,000,000,000,000,000,000,000,000,000,000,000,000,000,000,000,000,000,000,000",500,"520,142,814,311,432,000,000,000,000",NIH Chemical Genomics Center(NCGC),Kansas Specialized Chemistry Center,"Tom Misteli, National Cancer Institute",
ML316,Probing Metabolic Requirements for Fungal Virulence — Probe 1,MH086456-01,,56604860,588528,Mycoses,,,,,"588529,588529,602190,602190,602189,602189,588530,588530,623899,623899,623897,623897,623981,623981,624006,624006,623982,623982,588528,588634,602188,602394,602184,623969,624012,602187,623971,624025,602186,623903,623965,624014,602185,623904,623967,624013,624062,624068",784,"37,223,723,372,437,200,000,000,000,000,000",Broad Institute Probe Development Center,Broad Institute Probe Development Center,"Susan Lindquist, PhD, Whitehead Institute, Cambridge, MA",
ML317,"3-[(2,6-difluorobenzoyl)amino]-5-(4-ethoxyphenyl)thiophene-2-carboxylic acid inhibits E.coli UT189 bacterial capsule biogenesis.",MH090791 ,,18109210,488970,Bacterial Infections,,,,,"488,966,488,966,602,000,000,000,000,000",589,2114,Southern Research Molecular Libraries Screening Center,Kansas Specialized Chemistry Center,"Patrick Seed, Duke University",
ML318,"Identification of a small molecule inhibitor of Pseudomonas aeruginosa PvdQ acylase, an enzyme involved in siderophore pyoverdine synthesis",MH092076,,56604881,488968,Bacterial Infections,,,,,###############################################################################################################################################################################################################################################################,631,"242,824,292,431",Broad Institute Probe Development Center,Broad Institute Probe Development Center,"Dr. Andrew Gulick, Hauptman-Woodward Medical Research Institute, State University of New York, Buffalo, NY",
ML320,Discovery of Potent and Highly Selective Inhibitors of GSK3b,MH087442,,56840716,2119,Nervous System Diseases ,,,,,"20,974,349,546,239,800,000,000,000,000,000,000,000,000,000,000,000,000,000,000,000,000,000,000,000,000,000,000,000,000,000,000,000,000,000,000,000",474,"124,712,481,249,125,000,000,000,000,000,000,000",Broad Institute Probe Development Center,Broad Institute Probe Development Center,"Jen Pan, Stephen Haggarty, Broad Institute, Stanley Center",
ML321,"Discovery, optimization, and characterization of a novel series of dopamine D2 versus D3 receptor selective antagonists",NS064831,,57377246,485359,Immune System Diseases ,,,,,"485,344,624,453,624,000,000,000,000,000,000,000,000,000,000,000,000,000,000,000,000,000",591,"2,139,516,351,645,160,000,000,000,000",NIH Chemical Genomics Center(NCGC),NIH Chemical Genomics Center(NCGC),"David Sibley, NINDS",
ML322,"ML322, A Small Molecule Inhibitor of Dimerization of the Core Protein of Hepatitis C Virus (HCV)",MH085709-01 ,,49800087,1911,Virus diseases,,,,,"2,159,189,924,881,910,000,000,000,000,000,000,000,000,000,000,000,000,000,000,000,000,000,000",261,"6,341,596,224,422,450,000",The Scripps Research Institute,The Scripps Research Institute,"Arthur Strosberg, Scripps Research Institute",
ML323,Discovery of ML323 as a Novel Inhibitor of the USP1/UAF1 Deubiquitinase Complex,DA030552,,60167849,504878,Neoplasms,,,,,"504,865,540,327,651,000,000,000,000,000,000,000,000,000,000,000,000,000,000,000,000,000,000,000,000,000",609,"2,276,227,822,794,910,000,000,000,000",NIH Chemical Genomics Center(NCGC),NIH Chemical Genomics Center(NCGC),"Zhihao Zhuang, University of Delaware",
ML324,"Discovery of ML324, a JMJD2 demethylase inhibitor with demonstrated antiviral activity",MH084681,,44143209,2421,Virus diseases,,,,,"2,147,267,726,772,670,000,000,000,000,000,000",552,"178,517,861,787",NIH Chemical Genomics Center(NCGC),NIH Chemical Genomics Center(NCGC),"Udo Oppermann, Structural Genomics Consortium, University of Oxford",
ML325,Optimization and characterization of a pan protein arginine deiminase (PAD) inhibitor,GM079357-01,,13891339,463083,Immune System Diseases ,,,,,"463,073,485,272,488,000,000,000,000,000,000,000,000,000,000,000,000,000,000,000,000,000,000,000,000,000,000,000,000,000,000,000,000,000,000,000,000,000,000,000,000,000,000,000,000,000,000,000,000,000,000,000,000,000,000,000,000,000,000,000,000,000,000,000",484,"13,072,547,392,239,200,000,000,000,000,000",The Scripps Research Institute,The Scripps Research Institute,"Paul R. Thompson, The Scripps Research Institute, Jupiter, FL",
ML326,Development and characterization of a highly selective M5 PAM probe molecule  with improved potency,MH077607,,57525860,2416,Nervous System Diseases ,,,,AAF07823.1,"62,624,162,204,219,400,000,000,000,000,000,000",540,"17,001,701,170,217,000,000,000,000,000,000",The Scripps Research Institute,"Vanderbilt Specialized Chemistry Center for Accelerated Probe Development","Colleen M. Niswender, Vanderbilt University",
ML327,Discovery and characterization of a small molecule that restores E-cadherin expression in cancer cell lines via a new mechanism,CA95103-09,,60167648,651824,Neoplasms,,,,,651862,883,4784,,"Vanderbilt Specialized Chemistry Center for Accelerated Probe Development","R. Daniel Beauchamp, Vanderbilt University",
ML328,"ML328, A Novel Dual Inhibitor of Bacterial AddAB and RecBCD Helicasenuclease DNA Repair Enzymes",GM031693 ,,1517823,449731,Bacterial Infections,,,,,"435,030,488,942,492,000,000,000,000,000,000,000,000,000,000,000,000,000,000,000,000,000,000,000,000,000,000,000,000,000,000,000,000,000,000,000,000,000,000,000,000,000,000,000,000,000,000,000,000,000,000,000,000,000,000,000,000,000",564,"1,903,190,419,054,190,000,000,000,000",The Scripps Research Institute,The Scripps Research Institute,"G. Smith, Fred Hutchinson Cancer Research Center",
ML329,A Small Molecule Inhibitor of the MITF Molecular Pathway,DA031089-01,,12387471,488944,Neoplasms,,,,,"540,258,588,334,624,000,000,000,000,000,000,000,000,000,000,000",721,"234,331,023,103",Broad Institute Probe Development Center,Kansas Specialized Chemistry Center,"David E. Fisher, Department of Dermatology, Cutaneous Biology Research Center, Massachusetts General Hospital, Harvard Medical School",
ML330,Cardioprotective inhibitors of reperfusion injury,DA031671-01,,60202221,588508,Cardiovascular Diseases ,,,,,,,,,,,
ML331,Cardioprotective inhibitors of reperfusion injury,DA031671-01,2,60202247,588508,Cardiovascular Diseases ,,,,,"588,492,588,779,623,000,000,000,000,000,000,000,000,000,000,000,000,000,000,000,000,000,000,000,000,000,000,000,000,000,000,000,000,000,000,000,000,000",673,"2,721,272,227,232,720",Sanford-Burnham Center for Chemical Genomics,Sanford-Burnham Center for Chemical Genomics,"Richard Kitsis, Albert Einstein College of Medicine of Yeshiva University, USA",
ML332,Identification of a glycine sulfonamide based non-MPEP site positive allosteric potentiator (PAM) of mGlu5,MH062646,,60210882,588721,Nervous System Diseases ,,,,,"588,715,651,835,588,000,000,000,000,000,000,000,000,000,000,000,000,000,000,000,000,000,000,000,000,000",770,"3550,3551,3552,3553,3554,3555,3556,3557,3558,3559,3560,",,"Vanderbilt Specialized Chemistry Center for Accelerated Probe Development","P. Jeffrey Conn, Vanderbilt University",
ML333,N-(pyridin-4-yl)benzo[d]thiazole-6-carboxamide inhibits E. coli UT189 bacterial capsule biogenesis,MH090791-01,,18109210,488970,Bacterial Infections,,,,,"488,966,488,966,602,000,000,000,000,000,000,000,000,000,000,000,000,000,000,000,000,000,000,000,000,000,000,000,000,000,000,000,000,000,000,000,000,000,000,000,000,000,000,000,000,000,000,000,000,000,000,000,000,000",589,"211,421,252,126,212,000,000,000",Southern Research Molecular Libraries Screening Center,Kansas Specialized Chemistry Center,"Patrick Seed, Duke University",
ML334,The identification and characterization of non-reactive inhibitor of Keap1-Nrf2 interaction through HTS using a fluorescence polarization assay,MH093197,,56840728,504540,Neoplasms,,,,,"504,523,588,683,651,000,000,000,000,000,000,000,000,000,000,000,000,000,000,000,000,000,000,000,000,000,000,000,000,000,000,000,000,000,000,000,000,000,000,000",689,"28,142,816,281,728,100,000",Broad Institute Probe Development Center,Broad Institute Probe Development Center,"LONGQIN HU , Rutgers",
ML335,Characterization of an agonist probe for opioid receptor mu 1 (OPRM1)-opioid receptor delta 1 (OPRD1) heterodimerization,NS053751-01,,23723457,504355,Nervous System Diseases ,,,,,"504,326,504,357,504,000,000,000,000,000,000,000,000,000,000,000,000,000,000,000,000,000,000,000,000,000,000,000,000,000,000,000,000,000,000,000,000,000,000,000,000,000,000,000,000,000,000,000",142,"3,802,282,228,322,840,000",The Scripps Research Institute,The Scripps Research Institute,"Laksmi Devi, Mount Sinai School Of Medicine",
ML336,ML336: Development of Quinazolinone-Based Inhibitors Against Venezuelan Equine Encephalitis Virus (VEEV),MH087448-01A1,,60156253,588723,Virus diseases,,,,,###############################################################################################################################################################################################################################################################,670,"2,699,270,027,012,700,000,000,000,000",Southern Research Molecular Libraries Screening Center,Kansas Specialized Chemistry Center,"Dr. Donghoon Chung, University of Louisville",
ML337,Development of A Second Generation Selective mGlu3 NAM Probe,NS031373,,60204017,612451,Nervous System Diseases ,,,,,"623,885,651,839,623,000,000,000",748,"332,533,334,743",,"Vanderbilt Specialized Chemistry Center for Accelerated
Probe Development","P. Jeffrey Conn, Vanderbilt University",
ML338,"Elucidation of the physiology of non-replicating, drug tolerant Mycobacterium tuberculosis with the aid of the small molecule probe ML338",MH07444-01,,60182306,488929,Bacterial Infections,,,,,"488,890,488,890,488,000,000,000,000,000,000,000,000,000,000,000,000,000",742,"129,032,743,275,327,000,000,000",Southern Research Molecular Libraries Screening Center,Broad Institute Probe Development Center,"Deborah T. Hung, PhD, Broad Institute of MIT and Harvard, Cambridge, MA.",
ML339,Probing the CXCR6/CXCL16 Axis: Targeting Prevention of Prostate Cancer Metastasis,MH095589,,60202254,602249,Neoplasms,,,,,"602,244,602,409,624,000,000,000,000,000,000,000,000,000,000,000",800,"38,713,872,387,438,700,000",Sanford-Burnham Center for Chemical Genomics,Sanford-Burnham Center for Chemical Genomics,"Gregory P. Roth, Ph.D., Sanford-Burnham Medical Research Institute Russell S.Taichman, Ph.D., University of Michigan",
ML340,Small-molecule antagonists of Gli function,MH094195-01,,65389180,588433,Neoplasms,,,,,"588,413,602,428,602,000,000,000,000,000,000,000",725,"314,331,443,146",Sanford-Burnham Center for Chemical Genomics,Sanford-Burnham Center for Chemical Genomics,"James K. Chen, Ph.D., Stanford University, Stanford, CA, USA.",
ML341,"Identification of Diversity-Oriented Synthesis Derived Small Molecule, ML341, with Cidal Activity Against Trypanosoma cruzi",MH085673-01,,44493436,624280,Parasitic diseases,,,,,"6,242,556,517,396,510,000,000,000,000,000,000,000,000,000,000,000,000,000,000,000,000,000,000,000,000,000,000,000,000,000,000,000,000,000,000,000,000,000,000,000,000,000,000,000,000,000,000,000,000,000,000,000,000,000,000",730,"31,773,178,318,153,600,000,000,000,000,000",Broad Institute Probe Development Center,Broad Institute Probe Development Center,"Ana Rodriguez, PhD., New York University",
ML342,Inhibitors of FAP-fluorogen interaction as a multiplex assay tool compound for receptor internalization assays,DA031668-01,,2953239,651701,None,,,,,"588,775,623,882,623,000,000,000,000,000,000,000,000,000,000,000,000,000,000,000,000,000,000,000,000,000,000,000,000,000",906,"5036,5037,5038,5039,5040,5041,",New Mexico Molecular Libraries Screening Center,"Vanderbilt Specialized Chemistry Center for Accelerated Probe Development","Jonathan Jarvik, Carnegie Mellon University",
ML343,"Discovery of Two, Structurally Distinct Agonists of Vibrio cholerae Quorum Sensing Acting via the CqsS Membrane Receptor",MH094166-01,,57525036,,Bacterial Infections,,,,,,,,,,,
ML344,"Discovery of Two, Structurally Distinct Agonists of Vibrio cholerae Quorum Sensing Acting via the CqsS Membrane Receptor",MH094166-01,2,4727493,588521,Bacterial Infections,,,,,"588,436,602,243,588,000,000,000,000,000,000,000,000,000,000,000",734,"31,943,202,320,832,000,000",Broad Institute Probe Development Center,Broad Institute Probe Development Center,"Bonnie L. Bassler, PhD., Princeton University, Princeton, NJ",
ML345,"ML345, A Small-Molecule Inhibitor of the Insulin-Degrading Enzyme (IDE)",DA024888-01,,57390068,434984,Endocrine System Diseases ,,,,,"434,962,435,028,463,000,000,000,000,000,000,000,000,000,000,000,000,000,000,000,000,000,000,000,000,000,000,000,000,000,000,000,000,000",299,"93,293,326,782,679,200,000,000,000",The Scripps Research Institute,The Scripps Research Institute,"Malcolm Leissring, Scripps",
ML346,"ML346, A Novel Modulator of Proteostasis for Protein Conformational Diseases,1029,1618,1643",NS056337-02,,767276,588815,Nervous System Diseases ,,,,,"1259,651945,651948,651964,651992,651963,",936,"542,154,225,423,542,000,000,000",The Scripps Research Institute,The Scripps Research Institute,"R. Morimoto, Northwestern University",
